8189752,"Maron (priest of Apollo)",Maron,,,,,"priest of Apollo",Agent,8160370,Male,9494774,,,,
8189753,"Marpessa (daughter of Euenos)",Marpessa,,,,,"daughter of Euenos",Agent,8160370,Female,9494773,,,,
8189754,"Marpsios (suitor of Penelope)",Marpsios,,,,,"suitor of Penelope",Agent,8160370,Male,9494774,,,,
8189755,"Marse (daughter of Thespios)",Marse,,,,,"daughter of Thespios",Agent,8160370,Female,9494773,,,,
8189756,"Marsyas (lost musical competition with Apollo)",Marsyas,,,,,"lost musical competition with Apollo",Agent,8160370,Male,9494774,,,,
8189757,"Mecisteus (son of Talaos)",Mecisteus,,,,,"son of Talaos",Agent,8160370,Male,9494774,,,,
8189758,"Mecisteus (son of Lycaon)",Mecisteus,,,,,"son of Lycaon",Agent,8160370,Male,9494774,,,,
8189759,"Mecisteus (father of Odios and Epistrophios)",Mecisteus,,,,,"father of Odios and Epistrophios",Agent,8160370,Male,9494774,,,,
8189760,"Mecisteus (suitor of Penelope)",Mecisteus,,,,,"suitor of Penelope",Agent,8160370,Male,9494774,,,,
8189761,"Meda (wife of Idomeneus)",Meda,,,,,"wife of Idomeneus",Agent,8160370,Female,9494773,,,,
8189762,"Medeia Medea (wife of Jason, kills her own sons)",Medeia,,,Medea,,"wife of Jason, kills her own sons",Agent,8160370,Female,9494773,,,,
8189763,"Medesicaste (daughter of Priam)",Medesicaste,,,,,"daughter of Priam",Agent,8160370,Female,9494773,,,,
8189764,"Medesicaste (daughter of Laomedon)",Medesicaste,,,,,"daughter of Laomedon",Agent,8160370,Female,9494773,,,,
8189765,"Medon (suitor of Penelope)",Medon,,,,,"suitor of Penelope",Agent,8160370,Male,9494774,,,,
8189766,"Medos (son of Aigeus and Medeia)",Medos,,,,,"son of Aigeus and Medeia",Agent,8160370,Male,9494774,,,,
8189767,"Medousa Medusa (gorgon)",Medousa,,,Medusa,,gorgon,Agent,8160370,Female,9494773,,,,
8189768,"Medousa Medusa (daughter of Priam)",Medousa,,,Medusa,,"daughter of Priam",Agent,8160370,Female,9494773,,,,
8189769,"Medousa (daughter of Sthenelos)",Medousa,,,,,"daughter of Sthenelos",Agent,8160370,Female,9494773,,,,
8189770,"Megamede (daughter of Arneos)",Megamede,,,,,"daughter of Arneos",Agent,8160370,Female,9494773,,,,
8189771,"Meganeira (daughter of Crocon)",Meganeira,,,,,"daughter of Crocon",Agent,8160370,Female,9494773,,,,
8189772,"Megapenthes (son of Proitos)",Megapenthes,,,,,"son of Proitos",Agent,8160370,Male,9494774,,,,
8189773,"Megapenthes (son of Menelaos)",Megapenthes,,,,,"son of Menelaos",Agent,8160370,Male,9494774,,,,
8189774,"Megara (first wife of Heracles)",Megara,,,,,"first wife of Heracles",Agent,8160370,Female,9494773,,,,
8189775,"Megareus (son of Hippomenes)",Megareus,,,,,"son of Hippomenes",Agent,8160370,Male,9494774,,,,
8189776,"Megassares (king of the Hyrians)",Megassares,,,,,"king of the Hyrians",Agent,8160370,Male,9494774,,,,
8189777,"Megasthenes (suitor of Penelope)",Megasthenes,,,,,"suitor of Penelope",Agent,8160370,Male,9494774,,,,
8189778,"Meges (Greek leader at Troy)",Meges,,,,,"Greek leader at Troy",Agent,8160370,Male,9494774,,,,
8189779,"Melaineus (son of Lycaon)",Melaineus,,,,,"son of Lycaon",Agent,8160370,Male,9494774,,,,
8189780,"Melampous (seer)",Melampous,,,,,seer,Agent,8160370,Male,9494774,,,,
8189781,"Melanion (husband of Atalante)",Melanion,,,,,"husband of Atalante",Agent,8160370,Male,9494774,,,,
8189782,"Melanippe (Amazon)",Melanippe,,,,,Amazon,Agent,8160370,Female,9494773,,,,
8189783,"Melanippos (son of Astacos)",Melanippos,,,,,"son of Astacos",Agent,8160370,Male,9494774,,,,
8189784,"Melanippos (son of Priam)",Melanippos,,,,,"son of Priam",Agent,8160370,Male,9494774,,,,
8189785,"Melanippos (son of Agrios)",Melanippos,,,,,"son of Agrios",Agent,8160370,Male,9494774,,,,
8189786,"Melanthios (slave of Odysseus)",Melanthios,,,,,"slave of Odysseus",Agent,8160370,Male,9494774,,,,
8189787,"Melas (son of Phrixos)",Melas,,,,,"son of Phrixos",Agent,8160370,Male,9494774,,,,
8189788,"Melas (son of Porthaon)",Melas,,,,,"son of Porthaon",Agent,8160370,Male,9494774,,,,
8189789,"Melas (son of Licymnios)",Melas,,,,,"son of Licymnios",Agent,8160370,Male,9494774,,,,
8189790,"Meleagros Meleager (led Calydonian Boar hunt, Argonaut)",Meleagros,,,Meleager,,"led Calydonian Boar hunt, Argonaut",Agent,8160370,Male,9494774,,,,
8189791,"Melia (wife of Inachos)",Melia,,,,,"wife of Inachos",Agent,8160370,Female,9494773,,,,
8189792,"Meliboia (daughter of Niobe)",Meliboia,,,,,"daughter of Niobe",Agent,8160370,Female,9494773,,,,
8189793,"Meliboia (daughter of Oceanos)",Meliboia,,,,,"daughter of Oceanos",Agent,8160370,Female,9494773,,,,
8189794,"Melicertes (son of Athamas, becomes god Palaimon)",Melicertes,,,,,"son of Athamas, becomes god Palaimon",Agent,8160370,Male,9494774,,,,
8189795,"Meline (daughter of Thespios)",Meline,,,,,"daughter of Thespios",Agent,8160370,Female,9494773,,,,
8189796,"Melite (Nereid)",Melite,,,,,Nereid,Agent,8160370,Female,9494773,,,,
8189797,"Melpomene (Muse)",Melpomene,,,,,Muse,Agent,8160370,Female,9494773,,,,
8189798,"Memnon (son of Eos and Tithonos)",Memnon,,,,,"son of Eos and Tithonos",Agent,8160370,Male,9494774,,,,
8189799,"Memphis (daughter of Nile)",Memphis,,,,,"daughter of Nile",Agent,8160370,Female,9494773,,,,
8189800,"Memphis (mother of some Danaids)",Memphis,,,,,"mother of some Danaids",Agent,8160370,Female,9494773,,,,
8189801,"Menalces (son of Aigyptos)",Menalces,,,,,"son of Aigyptos",Agent,8160370,Male,9494774,,,,
8189802,"Menelaos (son of Atreus, husband of Helen)",Menelaos,,,,,"son of Atreus, husband of Helen",Agent,8160370,Male,9494774,,,,
8189803,"Menemachos (son of Aigyptos)",Menemachos,,,,,"son of Aigyptos",Agent,8160370,Male,9494774,,,,
8189804,"Meneptolemos (suitor of Penelope)",Meneptolemos,,,,,"suitor of Penelope",Agent,8160370,Male,9494774,,,,
8189805,"Menestheus (Greek leader at Troy)",Menestheus,,,,,"Greek leader at Troy",Agent,8160370,Male,9494774,,,,
8189806,"Menesthios (son of Spercheios)",Menesthios,,,,,"son of Spercheios",Agent,8160370,Male,9494774,,,,
8189807,"Menippis (daughter of Thespios)",Menippis,,,,,"daughter of Thespios",Agent,8160370,Female,9494773,,,,
8189808,"Menoiceus (father of Iocaste and Creon)",Menoiceus,,,,,"father of Iocaste and Creon",Agent,8160370,Male,9494774,,,,
8189809,"Menoiceus (son of Creon)",Menoiceus,,,,,"son of Creon",Agent,8160370,Male,9494774,,,,
8189810,"Menoites (herder of Hades' cattle)",Menoites,,,,,"herder of Hades' cattle",Agent,8160370,Male,9494774,,,,
8189811,"Menoitios (son of Actor, father of Patroclos)",Menoitios,,,,,"son of Actor, father of Patroclos",Agent,8160370,Male,9494774,,,,
8189812,"Menoitios (son of Iapetos)",Menoitios,,,,,"son of Iapetos",Agent,8160370,Male,9494774,,,,
8189813,"Mentor (son of Heracles)",Mentor,,,,,"son of Heracles",Agent,8160370,Male,9494774,,,,
8189814,"Mentor (son of Eurystheus)",Mentor,,,,,"son of Eurystheus",Agent,8160370,Male,9494774,,,,
8189815,"Merope (daugher of Atlas, wife of Sisyphos)",Merope,,,,,"daugher of Atlas, wife of Sisyphos",Agent,8160370,Female,9494773,,,,
8189816,"Merope (wife of Cresphontes)",Merope,,,,,"wife of Cresphontes",Agent,8160370,Female,9494773,,,,
8189817,"Merope (daughter of Oinopion)",Merope,,,,,"daughter of Oinopion",Agent,8160370,Female,9494773,,,,
8189818,"Merops (father of Arisbe)",Merops,,,,,"father of Arisbe",Agent,8160370,Male,9494774,,,,
8189819,"Mesthles (son of Talaimenes)",Mesthles,,,,,"son of Talaimenes",Agent,8160370,Male,9494774,,,,
8189820,"Mestor (son of Priam)",Mestor,,,,,"son of Priam",Agent,8160370,Male,9494774,,,,
8189821,"Mestor (son of Perseus)",Mestor,,,,,"son of Perseus",Agent,8160370,Male,9494774,,,,
8189822,"Mestor (son of Pterelaos)",Mestor,,,,,"son of Pterelaos",Agent,8160370,Male,9494774,,,,
8189823,"Meta (daughter of Hoples)",Meta,,,,,"daughter of Hoples",Agent,8160370,Female,9494773,,,,
8189824,"Metaneira (wife of Celeos)",Metaneira,,,,,"wife of Celeos",Agent,8160370,Female,9494773,,,,
8189825,"Metharme (daughter of Pygmalion)",Metharme,,,,,"daughter of Pygmalion",Agent,8160370,Female,9494773,,,,
8189826,"Metiadousa (daughter of Eupalamos)",Metiadousa,,,,,"daughter of Eupalamos",Agent,8160370,Female,9494773,,,,
8189827,"Metion (son of Erechtheus)",Metion,,,,,"son of Erechtheus",Agent,8160370,Male,9494774,,,,
8189828,"Metis (Oceanid, mother of Athena)",Metis,,,,,"Oceanid, mother of Athena",Agent,8160370,Female,9494773,,,,
8189829,"Metope (wife of Sangarios)",Metope,,,,,"wife of Sangarios",Agent,8160370,Female,9494773,,,,
8189830,"Metope (wife of Asopos)",Metope,,,,,"wife of Asopos",Agent,8160370,Female,9494773,,,,
8189831,"Mideia (mother of Licymnios)",Mideia,,,,,"mother of Licymnios",Agent,8160370,Female,9494773,,,,
8189832,"Miletos (son of Apollo)",Miletos,,,,,"son of Apollo",Agent,8160370,Male,9494774,,,,
8189833,"Mimas (giant)",Mimas,,,,,giant,Agent,8160370,Male,9494774,,,,
8189834,"Minis (suitor of Penelope)",Minis,,,,,"suitor of Penelope",Agent,8160370,Male,9494774,,,,
8189835,"Minos (king of Crete)",Minos,,,,,"king of Crete",Agent,8160370,Male,9494774,,,,
8189836,"Minyas (father of Clymene)",Minyas,,,,,"father of Clymene",Agent,8160370,Male,9494774,,,,
8189837,"Mnesileos (son of Polydeuces)",Mnesileos,,,,,"son of Polydeuces",Agent,8160370,Male,9494774,,,,
8189838,"Mnesimache (daughter of Dexamenos)",Mnesimache,,,,,"daughter of Dexamenos",Agent,8160370,Female,9494773,,,,
8189839,"Mnestra (Danaid)",Mnestra,,,,,Danaid,Agent,8160370,Female,9494773,,,,
8189840,"the Moirai the Parcae (the Fates)","the Moirai",,,"the Parcae",,"the Fates","Collective (misc.)",8160371,,,,,,
8189841,"Molebos (suitor of Penelope)",Molebos,,,,,"suitor of Penelope",Agent,8160370,Male,9494774,,,,
8189842,"Molione (mother of the Molionidai)",Molione,,,,,"mother of the Molionidai",Agent,8160370,Female,9494773,,,,
8189843,"the Molionidai (conjoined sons of Molione)","the Molionidai",,,,,"conjoined sons of Molione","Collective (genealogical)",9650159,Male,9494774,"Molione (mother of the Molionidai)",8189842,,
8189844,"Molorchos (Heracles' host in Cleonai)",Molorchos,,,,,"Heracles' host in Cleonai",Agent,8160370,Male,9494774,,,,
8189845,"Molos (son of Ares)",Molos,,,,,"son of Ares",Agent,8160370,Male,9494774,,,,
8189846,"Molos (son of Deucalion)",Molos,,,,,"son of Deucalion",Agent,8160370,Male,9494774,,,,
8189847,"Molossos (son of Neoptolemos)",Molossos,,,,,"son of Neoptolemos",Agent,8160370,Male,9494774,,,,
8189848,"Mopsos (son of Apollo)",Mopsos,,,,,"son of Apollo",Agent,8160370,Male,9494774,,,,
8189849,"Mygdalion (father of an unknown son)",Mygdalion,,,,,"father of an unknown son",Agent,8160370,Male,9494774,,,,
8189850,"Mygdon (king of the Bebryces)",Mygdon,,,,,"king of the Bebryces",Agent,8160370,Male,9494774,,,,
8189851,"Mylios (son of Priam)",Mylios,,,,,"son of Priam",Agent,8160370,Male,9494774,,,,
8189852,"Mynes (father of Pedias)",Mynes,,,,,"father of Pedias",Agent,8160370,Male,9494774,,,,
8189853,"Myrmidon (son of Zeus)",Myrmidon,,,,,"son of Zeus",Agent,8160370,Male,9494774,,,,
8189854,"Myrtilos (son of Hermes)",Myrtilos,,,,,"son of Hermes",Agent,8160370,Male,9494774,,,,
8189855,"Nastes (son of Nomion)",Nastes,,,,,"son of Nomion",Agent,8160370,Male,9494774,,,,
8189856,"Naubolos (father of Iphitos)",Naubolos,,,,,"father of Iphitos",Agent,8160370,Male,9494774,,,,
8189857,"Naucrate (slave of Minos)",Naucrate,,,,,"slave of Minos",Agent,8160370,Female,9494773,,,,
8189858,"Nauplios (son of Poseidon)",Nauplios,,,,,"son of Poseidon",Agent,8160370,Male,9494774,,,,
8189859,"Nausicaa (daughter of Alcinoos)",Nausicaa,,,,,"daughter of Alcinoos",Agent,8160370,Female,9494773,,,,
8189860,"Nausimedon (son of Nauplios)",Nausimedon,,,,,"son of Nauplios",Agent,8160370,Male,9494774,,,,
8189861,"Nausithoe (Nereid)",Nausithoe,,,,,Nereid,Agent,8160370,Female,9494773,,,,
8189862,"Neaira (daughter of Niobe)",Neaira,,,,,"daughter of Niobe",Agent,8160370,Female,9494773,,,,
8189863,"Neaira (daughter of Pereus)",Neaira,,,,,"daughter of Pereus",Agent,8160370,Female,9494773,,,,
8189864,"Neaira (wife of Strymon)",Neaira,,,,,"wife of Strymon",Agent,8160370,Female,9494773,,,,
8189865,"Nebrophonos (son of Jason and Hypsipyle)",Nebrophonos,,,,,"son of Jason and Hypsipyle",Agent,8160370,Male,9494774,,,,
8189866,"Neleus (son of Poseidon and Tyro, father of Nestor)",Neleus,,,,,"son of Poseidon and Tyro, father of Nestor",Agent,8160370,Male,9494774,,,,
8189867,"Nelo (Danaid)",Nelo,,,,,Danaid,Agent,8160370,Female,9494773,,,,
8189868,"the Nemean Lion (invulnerable lion)","the Nemean Lion",,,,,"invulnerable lion",Agent,8160370,Male,9494774,,,,
8189869,"Nemesis (goddess of retribution)",Nemesis,,,,,"goddess of retribution",Agent,8160370,Female,9494773,,,,
8189870,"Neomeris (Nereid)",Neomeris,,,,,Nereid,Agent,8160370,Female,9494773,,,,
8189871,"Neoptolemos (later name for Pyrrhos, son of Achilles)",Neoptolemos,,,,,"later name for Pyrrhos, son of Achilles",Agent,8160370,Male,9494774,,,,
8189872,"Nephalion (son of Minos)",Nephalion,,,,,"son of Minos",Agent,8160370,Male,9494774,,,,
8189873,"Nephos (son of Heracles)",Nephos,,,,,"son of Heracles",Agent,8160370,Male,9494774,,,,
8189874,"the Nereids (daughters of Nereus)","the Nereids",,,,,"daughters of Nereus","Collective (genealogical)",9650159,Female,9494773,"Nereus (son of Pontos and Ge, father of the Nereids)",8189875,,
8189875,"Nereus (son of Pontos and Ge, father of the Nereids)",Nereus,,,,,"son of Pontos and Ge, father of the Nereids",Agent,8160370,Male,9494774,,,,
8189876,"Nesaia (Nereid)",Nesaia,,,,,Nereid,Agent,8160370,Female,9494773,,,,
8189877,"Nessos (Centaur)",Nessos,,,,,Centaur,Agent,8160370,Male,9494774,,,,
8189878,"Nestor (Greek leader at Troy)",Nestor,,,,,"Greek leader at Troy",Agent,8160370,Male,9494774,,,,
8189879,"Nicippe (daughter of Pelops)",Nicippe,,,,,"daughter of Pelops",Agent,8160370,Female,9494773,,,,
8189880,"Nicippe (daughter of Thespios)",Nicippe,,,,,"daughter of Thespios",Agent,8160370,Female,9494773,,,,
8189881,"Nicodromos (son of Heracles)",Nicodromos,,,,,"son of Heracles",Agent,8160370,Male,9494774,,,,
8189882,"Nicomachos (suitor of Penelope)",Nicomachos,,,,,"suitor of Penelope",Agent,8160370,Male,9494774,,,,
8189883,"Nicostratos (son of Menelaos)",Nicostratos,,,,,"son of Menelaos",Agent,8160370,Male,9494774,,,,
8189884,"Nike (personification of victory)",Nike,,,,,"personification of victory",Agent,8160370,Female,9494773,,,,
8189885,"Nike (daughter of Thespios)",Nike,,,,,"daughter of Thespios",Agent,8160370,Female,9494773,,,,
8189886,"Nile Nilus (river god)",Nile,,,Nilus,,"river god",Agent,8160370,Male,9494774,,,,
8189887,"Niobe (daughter of Phoroneus)",Niobe,,,,,"daughter of Phoroneus",Agent,8160370,Female,9494773,,,,
8189888,"Niobe (daughter of Tantalus, wife of Amphion)",Niobe,,,,,"daughter of Tantalus, wife of Amphion",Agent,8160370,Female,9494773,,,,
8189889,"Nireus (Greek leader at Troy)",Nireus,,,,,"Greek leader at Troy",Agent,8160370,Male,9494774,,,,
8189890,"Nireus (son of Poseidon)",Nireus,,,,,"son of Poseidon",Agent,8160370,Male,9494774,,,,
8189891,"Nisas (suitor of Penelope)",Nisas,,,,,"suitor of Penelope",Agent,8160370,Male,9494774,,,,
8189892,"Nisos (son of Pandion)",Nisos,,,,,"son of Pandion",Agent,8160370,Male,9494774,,,,
8189893,"Nissaios (suitor of Penelope)",Nissaios,,,,,"suitor of Penelope",Agent,8160370,Male,9494774,,,,
8189894,"Nomion (father of Nastes and Amphimachos)",Nomion,,,,,"father of Nastes and Amphimachos",Agent,8160370,Male,9494774,,,,
8189895,"Nycteis (daughter of Nycteus)",Nycteis,,,,,"daughter of Nycteus",Agent,8160370,Female,9494773,,,,
8189896,"Nycteus (son of Chthonios)",Nycteus,,,,,"son of Chthonios",Agent,8160370,Male,9494774,,,,
8189897,"Nyctimos (son of Lycaon)",Nyctimos,,,,,"son of Lycaon",Agent,8160370,Male,9494774,,,,
8189898,"the Oceanids (daughters of Oceanos and Tethys)","the Oceanids",,,,,"daughters of Oceanos and Tethys","Collective (genealogical)",9650159,Female,9494773,"Oceanos (Titan, personification of Ocean)",8188399,,
8189899,"Ocypete (Harpy)",Ocypete,,,,,Harpy,Agent,8160370,Female,9494773,,,,
8189900,"Ocytos (father of Gouneus)",Ocytos,,,,,"father of Gouneus",Agent,8160370,Male,9494774,,,,
8189901,"Odios (son of Mecisteus)",Odios,,,,,"son of Mecisteus",Agent,8160370,Male,9494774,,,,
8189902,"Odysseus (king of Ithaca, Greek leader at Troy)",Odysseus,,,,,"king of Ithaca, Greek leader at Troy",Agent,8160370,Male,9494774,,,,
8189903,"Ogygia (daughter of Niobe)",Ogygia,,,,,"daughter of Niobe",Agent,8160370,Female,9494773,,,,
8189904,"Oiagros (father of Orpheus)",Oiagros,,,,,"father of Orpheus",Agent,8160370,Male,9494774,,,,
8189905,"Oiax (son of Nauplios)",Oiax,,,,,"son of Nauplios",Agent,8160370,Male,9494774,,,,
8189906,"Oibalos (son of Perieres)",Oibalos,,,,,"son of Perieres",Agent,8160370,Male,9494774,,,,
8189907,"Oicles (father of Amphiaraos)",Oicles,,,,,"father of Amphiaraos",Agent,8160370,Male,9494774,,,,
8189908,"Oileus Ileus (father of Aias)",Oileus,,,,Ileus,"father of Aias",Agent,8160370,Male,9494774,,,,
8189909,"Oime (Danaid)",Oime,,,,,Danaid,Agent,8160370,Female,9494773,,,,
8189910,"Oineus Oeneus (king of Calydon)",Oineus,,Oeneus,,,"king of Calydon",Agent,8160370,Male,9494774,,,,
8189911,"Oineus (son of Aigyptos)",Oineus,,,,,"son of Aigyptos",Agent,8160370,Male,9494774,,,,
8189912,"Oino (daughter of Anios)",Oino,,,,,"daughter of Anios",Agent,8160370,Female,9494773,,,,
8189913,"Oinomaos (king of Pisa)",Oinomaos,,,,,"king of Pisa",Agent,8160370,Male,9494774,,,,
8189914,"Oinone (daughter of Cebren)",Oinone,,,,,"daughter of Cebren",Agent,8160370,Female,9494773,,,,
8189915,"Oinopion (son of Dionysos and Ariadne)",Oinopion,,,,,"son of Dionysos and Ariadne",Agent,8160370,Male,9494774,,,,
8189916,"the Oinotrophoi (the daughters of Anios)","the Oinotrophoi",,,,,"the daughters of Anios","Collective (genealogical)",9650159,,,,,,
8189917,"Oistrobles (son of Heracles)",Oistrobles,,,,,"son of Heracles",Agent,8160370,Male,9494774,,,,
8189918,"Olenias (brother of Tydeus)",Olenias,,,,,"brother of Tydeus",Agent,8160370,Male,9494774,,,,
8189919,"Oloitrochos (suitor of Penelope)",Oloitrochos,,,,,"suitor of Penelope",Agent,8160370,Male,9494774,,,,
8189920,"Olympos (father of Marsyas)",Olympos,,,,,"father of Marsyas",Agent,8160370,Male,9494774,,,,
8189921,"Olympos (son of Heracles)",Olympos,,,,,"son of Heracles",Agent,8160370,Male,9494774,,,,
8189922,"Olympouse (daughter of Thespios)",Olympouse,,,,,"daughter of Thespios",Agent,8160370,Female,9494773,,,,
8189923,"Omargos (one of Actaion's dogs)",Omargos,,,,,"one of Actaion's dogs",Agent,8160370,Male,9494774,,,,
8189924,"Omphale (queen of Lydia)",Omphale,,,,,"queen of Lydia",Agent,8160370,Female,9494773,,,,
8189925,"Onchestos (son of Agrios)",Onchestos,,,,,"son of Agrios",Agent,8160370,Male,9494774,,,,
8189926,"Oneites (son of Heracles)",Oneites,,,,,"son of Heracles",Agent,8160370,Male,9494774,,,,
8189927,"Onesippos (son of Heracles)",Onesippos,,,,,"son of Heracles",Agent,8160370,Male,9494774,,,,
8189928,"Opheltes (son of Lycourgos)",Opheltes,,,,,"son of Lycourgos",Agent,8160370,Male,9494774,,,,
8189929,"Opis (Hyperborean virgin)",Opis,,,,,"Hyperborean virgin",Agent,8160370,Female,9494773,,,,
8189930,"Orchomenos (father of Elare)",Orchomenos,,,,,"father of Elare",Agent,8160370,Male,9494774,,,,
8189931,"Orchomenos (son of Lycaon)",Orchomenos,,,,,"son of Lycaon",Agent,8160370,Male,9494774,,,,
8189932,"Orchomenos (son of Thyestes)",Orchomenos,,,,,"son of Thyestes",Agent,8160370,Male,9494774,,,,
8189941,"Proto (Nereid)",Proto,,,,,Nereid,Agent,8160370,Female,9494773,,,,
8189942,"Protogeneia (daughter of Deucalion)",Protogeneia,,,,,"daughter of Deucalion",Agent,8160370,Female,9494773,,,,
8189943,"Protogeneia (daughter of Calydon)",Protogeneia,,,,,"daughter of Calydon",Agent,8160370,Female,9494773,,,,
8189944,"Psamathe (Nereid)",Psamathe,,,,,Nereid,Agent,8160370,Female,9494773,,,,
8189945,"Pseras (suitor of Penelope)",Pseras,,,,,"suitor of Penelope",Agent,8160370,Male,9494774,,,,
8189946,"Pteleon (sleeps with Procris)",Pteleon,,,,,"sleeps with Procris",Agent,8160370,Male,9494774,,,,
8189947,"Pterelaos (son of Taphios)",Pterelaos,,,,,"son of Taphios",Agent,8160370,Male,9494774,,,,
8189948,"Ptolemaios (suitor of Penelope)",Ptolemaios,,,,,"suitor of Penelope",Agent,8160370,Male,9494774,,,,
8189949,"Ptoos (son of Athamas)",Ptoos,,,,,"son of Athamas",Agent,8160370,Male,9494774,,,,
8189950,"Pygmalion (king of Cyprus)",Pygmalion,,,,,"king of Cyprus",Agent,8160370,Male,9494774,,,,
8189951,"Pylades (son of Strophios)",Pylades,,,,,"son of Strophios",Agent,8160370,Male,9494774,,,,
8189952,"Pylaimenes (son of Bisaltes)",Pylaimenes,,,,,"son of Bisaltes",Agent,8160370,Male,9494774,,,,
8189953,"Pylaimenes (suitor of Penelope)",Pylaimenes,,,,,"suitor of Penelope",Agent,8160370,Male,9494774,,,,
8189954,"Pylaon (son of Neleus)",Pylaon,,,,,"son of Neleus",Agent,8160370,Male,9494774,,,,
8189955,"Pylarge (Danaid)",Pylarge,,,,,Danaid,Agent,8160370,Female,9494773,,,,
8189956,"Pylas (king of Megara)",Pylas,,,,,"king of Megara",Agent,8160370,Male,9494774,,,,
8189957,"Pylia (daughter of Pylas)",Pylia,,,,,"daughter of Pylas",Agent,8160370,Female,9494773,,,,
8189958,"Pylios (Heracles' adoptive father in Eleusis)",Pylios,,,,,"Heracles' adoptive father in Eleusis",Agent,8160370,Male,9494774,,,,
8189959,"Pylos (son of Ares)",Pylos,,,,,"son of Ares",Agent,8160370,Male,9494774,,,,
8189960,"Pyraichmes (Trojan ally)",Pyraichmes,,,,,"Trojan ally",Agent,8160370,Male,9494774,,,,
8189961,"Pyrene (mother of Cycnos)",Pyrene,,,,,"mother of Cycnos",Agent,8160370,Female,9494773,,,,
8189962,"Pyrippe (daughter of Thespios)",Pyrippe,,,,,"daughter of Thespios",Agent,8160370,Female,9494773,,,,
8189963,"Pyrrha (daughter of Epimetheus, wife of Deucalion)",Pyrrha,,,,,"daughter of Epimetheus, wife of Deucalion",Agent,8160370,Female,9494773,,,,
8189964,"Pyrrhos (son of Achilles)",Pyrrhos,,,,,"son of Achilles",Agent,8160370,Male,9494774,,,,
8189965,"Pythia (Apollo's priestess at the oracle of Delphi)",Pythia,,,,,"Apollo's priestess at the oracle of Delphi",Agent,8160370,Female,9494773,,,,
8189966,"Python (guardian serpent at Delphi)",Python,,,,,"guardian serpent at Delphi",Agent,8160370,Undefined,9494775,,,,
8189967,"Rhadamanthys (son of Zeus and Europa)",Rhadamanthys,,,,,"son of Zeus and Europa",Agent,8160370,Male,9494774,,,,
8189968,"Rhesos (son of Euterpe and Strymon)",Rhesos,,,,,"son of Euterpe and Strymon",Agent,8160370,Male,9494774,,,,
8189969,"Rhexenor (father of Chalciope)",Rhexenor,,,,,"father of Chalciope",Agent,8160370,Male,9494774,,,,
8189970,"Rhode (daughter of Poseidon and Amphitrite)",Rhode,,,,,"daughter of Poseidon and Amphitrite",Agent,8160370,Female,9494773,,,,
8189971,"Rhode (Danaid)",Rhode,,,,,Danaid,Agent,8160370,Female,9494773,,,,
8189972,"Rhodia (Danaid)",Rhodia,,,,,Danaid,Agent,8160370,Female,9494773,,,,
8189973,"Rhoicos (Centaur)",Rhoicos,,,,,Centaur,Agent,8160370,Male,9494774,,,,
8189974,"Salmoneus (son of Aiolos)",Salmoneus,,,,,"son of Aiolos",Agent,8160370,Male,9494774,,,,
8189975,"Sandocos (son of Astynoos)",Sandocos,,,,,"son of Astynoos",Agent,8160370,Male,9494774,,,,
8189976,"Sangarios (river god)",Sangarios,,,,,"river god",Agent,8160370,Male,9494774,,,,
8189977,"Sao (Nereid)",Sao,,,,,Nereid,Agent,8160370,Female,9494773,,,,
8189978,"Sarapis (a form of the syncretised Egyptian gods Osiris-Apis)",Sarapis,,,,,"a form of the syncretised Egyptian gods Osiris-Apis",Agent,8160370,Male,9494774,,,,
8189979,"Sarpedon (son of Zeus and Europa)",Sarpedon,,,,,"son of Zeus and Europa",Agent,8160370,Male,9494774,,,,
8189980,"Sarpedon (son of Poseidon)",Sarpedon,,,,,"son of Poseidon",Agent,8160370,Male,9494774,,,,
8189981,"Satyros (steals Arcadian cattle)",Satyros,,,,,"steals Arcadian cattle",Agent,8160370,Male,9494774,,,,
8189982,"the Satyrs (companions of Dionysos)","the Satyrs",,,,,"companions of Dionysos","Collective (misc.)",8160371,,,,,,
8189983,"Scaia (Danaid)",Scaia,,,,,Danaid,Agent,8160370,Female,9494773,,,,
8189984,"Scaios (son of Hippocoon)",Scaios,,,,,"son of Hippocoon",Agent,8160370,Male,9494774,,,,
8189985,"Scamandros (river god near Troy)",Scamandros,,,,,"river god near Troy",Agent,8160370,Male,9494774,,,,
8189986,"Sceiron (father of Endeis)",Sceiron,,,,,"father of Endeis",Agent,8160370,Male,9494774,,,,
8189987,"Schedios (son of Iphitos)",Schedios,,,,,"son of Iphitos",Agent,8160370,Male,9494774,,,,
8189988,"Schoineus (father of Atalante)",Schoineus,,,,,"father of Atalante",Agent,8160370,Male,9494774,,,,
8189989,"Scylla (sea monster)",Scylla,,,,,"sea monster",Agent,8160370,Female,9494773,,,,
8189990,"Scylla (daughter of Nisos)",Scylla,,,,,"daughter of Nisos",Agent,8160370,Female,9494773,,,,
8189991,"Scyrios (father of Aigeus)",Scyrios,,,,,"father of Aigeus",Agent,8160370,Male,9494774,,,,
8189992,"Seilenos Silenus (attendant of Dionysos)",Seilenos,,,Silenus,,"attendant of Dionysos",Agent,8160370,Male,9494774,,,,
8189993,"Selene (personification of the moon)",Selene,,,,,"personification of the moon",Agent,8160370,Female,9494773,,,,
8189994,"Semele (mother of Dionysos by Zeus)",Semele,,,,,"mother of Dionysos by Zeus",Agent,8160370,Female,9494773,,,,
8189995,"Side (wife of Orion)",Side,,,,,"wife of Orion",Agent,8160370,Female,9494773,,,,
8189996,"Sidero (wife of Salmoneus, stepmother of Tyro)",Sidero,,,,,"wife of Salmoneus, stepmother of Tyro",Agent,8160370,Female,9494773,,,,
8189997,"Simoeis (river god at Troy)",Simoeis,,,,,"river god at Troy",Agent,8160370,Male,9494774,,,,
8189998,"Sinis (son of Polypemon)",Sinis,,,,,"son of Polypemon",Agent,8160370,Male,9494774,,,,
8189999,"Sinon (Greek warrior at Troy)",Sinon,,,,,"Greek warrior at Troy",Agent,8160370,Male,9494774,,,,
8190000,"Sipylos (son of Niobe)",Sipylos,,,,,"son of Niobe",Agent,8160370,Male,9494774,,,,
8190001,"the Sirens (daughters of Melpomene and Acheloos)","the Sirens",,,,,"daughters of Melpomene and Acheloos","Collective (misc.)",8160371,,,,,,
8190002,"Sisyphos (son of Aiolos)",Sisyphos,,,,,"son of Aiolos",Agent,8160370,Male,9494774,,,,
8190003,"Smyrna (daughter of Theias)",Smyrna,,,,,"daughter of Theias",Agent,8160370,Female,9494773,,,,
8190004,"Socleus (son of Lycaon)",Socleus,,,,,"son of Lycaon",Agent,8160370,Male,9494774,,,,
8190005,"Sparte (daughter of Eurotas)",Sparte,,,,,"daughter of Eurotas",Agent,8160370,Female,9494773,,,,
