8188540,"Hopleus (son of Poseidon)",Hopleus,,,,,"son of Poseidon",Agent,8160370,Male,9494774,,,,
8188541,"Horos (son of Lycaon)",Horos,,,,,"son of Lycaon",Agent,8160370,Male,9494774,,,,
8188542,"Hyacinthos (loved by Apollo)",Hyacinthos,,,,,"loved by Apollo",Agent,8160370,Male,9494774,,,,
8188543,"Hyacinthos (Lacedaimonian who settled in Athens)",Hyacinthos,,,,,"Lacedaimonian who settled in Athens",Agent,8160370,Male,9494774,,,,
8188544,"the Hyades (nymphs who raise Dionysos, turned into stars)","the Hyades",,,,,"nymphs who raise Dionysos, turned into stars","Collective (misc.)",8160371,,,,,,
8188545,"the Hydra (multi-headed monstrous serpent)","the Hydra",,,,,"multi-headed monstrous serpent",Agent,8160370,Undefined,9494775,,,,
8188546,"Hylaios (Centaur)",Hylaios,,,,,Centaur,Agent,8160370,Male,9494774,,,,
8188547,"Hylas (beloved of Heracles)",Hylas,,,,,"beloved of Heracles",Agent,8160370,Male,9494774,,,,
8188548,"Hyleus (Calydonian boar hunter)",Hyleus,,,,,"Calydonian boar hunter",Agent,8160370,Male,9494774,,,,
8188549,"Hyllos (son of Heracles)",Hyllos,,,,,"son of Heracles",Agent,8160370,Male,9494774,,,,
8188550,"Hymenaios (raised from dead by Asclepios)",Hymenaios,,,,,"raised from dead by Asclepios",Agent,8160370,Male,9494774,,,,
8188551,"Hypeirochos (son of Priam)",Hypeirochos,,,,,"son of Priam",Agent,8160370,Male,9494774,,,,
8188552,"Hyperbios (son of Aigyptos)",Hyperbios,,,,,"son of Aigyptos",Agent,8160370,Male,9494774,,,,
8188553,"Hyperenor (one of the Spartoi)",Hyperenor,,,,,"one of the Spartoi",Agent,8160370,Male,9494774,,,,
8188554,"Hyperenor (son of Poseidon and Alcyone)",Hyperenor,,,,,"son of Poseidon and Alcyone",Agent,8160370,Male,9494774,,,,
8188555,"Hyperenor (suitor of Penelope)",Hyperenor,,,,,"suitor of Penelope",Agent,8160370,Male,9494774,,,,
8188556,"Hyperion (son of Priam)",Hyperion,,,,,"son of Priam",Agent,8160370,Male,9494774,,,,
8188557,"Hypseus (father of Themisto)",Hypseus,,,,,"father of Themisto",Agent,8160370,Male,9494774,,,,
8188558,"Hypsipyle (queen of Lemnos)",Hypsipyle,,,,,"queen of Lemnos",Agent,8160370,Female,9494773,,,,
8188559,"Hyrieus (son of Alcyone)",Hyrieus,,,,,"son of Alcyone",Agent,8160370,Male,9494774,,,,
8188560,"Hyrnetho (daughter of Temenos)",Hyrnetho,,,,,"daughter of Temenos",Agent,8160370,Female,9494773,,,,
8188561,"Hyrtacos (husband of Arisbe)",Hyrtacos,,,,,"husband of Arisbe",Agent,8160370,Male,9494774,,,,
8188562,"Ialebion (son of Poseidon)",Ialebion,,,,,"son of Poseidon",Agent,8160370,Male,9494774,,,,
8188563,"Ialmenos (Greek leader at Troy, son of Ares)",Ialmenos,,,,,"Greek leader at Troy, son of Ares",Agent,8160370,Male,9494774,,,,
8188564,"Ianeira (Nereid)",Ianeira,,,,,Nereid,Agent,8160370,Female,9494773,,,,
8188565,"Iardanes (father of Omphale)",Iardanes,,,,,"father of Omphale",Agent,8160370,Male,9494774,,,,
8188566,"Iasion (son of Zeus and Electra)",Iasion,,,,,"son of Zeus and Electra",Agent,8160370,Male,9494774,,,,
8188567,"Iasos Iasius (son of Lycourgos)",Iasos,,,Iasius,,"son of Lycourgos",Agent,8160370,Male,9494774,,,,
8188568,"Iasos (son of Argos)",Iasos,,,,,"son of Argos",Agent,8160370,Male,9494774,,,,
8188569,"Icarios (Dionysos' host in Attica)",Icarios,,,,,"Dionysos' host in Attica",Agent,8160370,Male,9494774,,,,
8188570,"Icarios (son of Perieres, father of Penelope)",Icarios,,,,,"son of Perieres, father of Penelope",Agent,8160370,Male,9494774,,,,
8188571,"Idaia (nymph)",Idaia,,,,,nymph,Agent,8160370,Female,9494773,,,,
8188572,"Idaia (daughter of Dardanos)",Idaia,,,,,"daughter of Dardanos",Agent,8160370,Female,9494773,,,,
8188573,"Idas (Calydonian boar hunter, Argonaut)",Idas,,,,,"Calydonian boar hunter, Argonaut",Agent,8160370,Male,9494774,,,,
8188574,"Idas (son of Aigyptos)",Idas,,,,,"son of Aigyptos",Agent,8160370,Male,9494774,,,,
8188575,"Idmon (Argonaut, prophet)",Idmon,,,,,"Argonaut, prophet",Agent,8160370,Male,9494774,,,,
8188576,"Idomeneus (son of Deucalion)",Idomeneus,,,,,"son of Deucalion",Agent,8160370,Male,9494774,,,,
8188577,"Idomeneus (son of Priam)",Idomeneus,,,,,"son of Priam",Agent,8160370,Male,9494774,,,,
8188578,"Illyrios (son of Cadmos)",Illyrios,,,,,"son of Cadmos",Agent,8160370,Male,9494774,,,,
8188579,"Ilos (son of Dardanos)",Ilos,,,,,"son of Dardanos",Agent,8160370,Male,9494774,,,,
8188580,"Ilos (son of Tros)",Ilos,,,,,"son of Tros",Agent,8160370,Male,9494774,,,,
8188581,"Imbros (son of Aigyptos)",Imbros,,,,,"son of Aigyptos",Agent,8160370,Male,9494774,,,,
8188582,"Imeusimos (son of Icarios)",Imeusimos,,,,,"son of Icarios",Agent,8160370,Male,9494774,,,,
8188583,"Inachos (river god in Argos)",Inachos,,,,,"river god in Argos",Agent,8160370,Male,9494774,,,,
8188584,"Indios (suitor of Penelope)",Indios,,,,,"suitor of Penelope",Agent,8160370,Male,9494774,,,,
8188585,"Ino (daughter of Cadmos, becomes goddess Leucothea)",Ino,,,,,"daughter of Cadmos, becomes goddess Leucothea",Agent,8160370,Female,9494773,,,,
8188586,"Iobates (king of Lycia)",Iobates,,,,,"king of Lycia",Agent,8160370,Male,9494774,,,,
8188587,"Iobes (son of Heracles)",Iobes,,,,,"son of Heracles",Agent,8160370,Male,9494774,,,,
8188588,"Iocaste Jocasta (mother and wife of Oidipous)",Iocaste,,,Jocasta,,"mother and wife of Oidipous",Agent,8160370,Female,9494773,,,,
8188589,"Iolaos (son of Iphicles, companion of Heracles)",Iolaos,,,,,"son of Iphicles, companion of Heracles",Agent,8160370,Male,9494774,,,,
8188590,"Iole (daughter of Eurytos)",Iole,,,,,"daughter of Eurytos",Agent,8160370,Female,9494773,,,,
8188591,"Ion (eponym of the Ionians)",Ion,,,,,"eponym of the Ionians",Agent,8160370,Male,9494774,,,,
8188592,"Ione (Nereid)",Ione,,,,,Nereid,Agent,8160370,Female,9494773,,,,
8188593,"Iphianassa (mother of Aitolos)",Iphianassa,,,,,"mother of Aitolos",Agent,8160370,Female,9494773,,,,
8188594,"Iphianassa (daughter of Proitos)",Iphianassa,,,,,"daughter of Proitos",Agent,8160370,Female,9494773,,,,
8188595,"Iphiclos (Argonaut, son of Phylacos)",Iphiclos,,,,,"Argonaut, son of Phylacos",Agent,8160370,Male,9494774,,,,
8188596,"Iphiclos (Argonaut, son of Thestios)",Iphiclos,,,,,"Argonaut, son of Thestios",Agent,8160370,Male,9494774,,,,
8188597,"Iphidamas (suitor of Penelope)",Iphidamas,,,,,"suitor of Penelope",Agent,8160370,Male,9494774,,,,
8188598,"Iphigeneia (daughter of Agamemnon)",Iphigeneia,,,,,"daughter of Agamemnon",Agent,8160370,Female,9494773,,,,
8188599,"Iphimachus (takes care of Philoctetes on Lemnos)",Iphimachus,,,,,"takes care of Philoctetes on Lemnos",Agent,8160370,Male,9494774,,,,
8188600,"Iphimedeia (daughter of Triops)",Iphimedeia,,,,,"daughter of Triops",Agent,8160370,Female,9494773,,,,
8188601,"Iphimedon (son of Eurystheus)",Iphimedon,,,,,"son of Eurystheus",Agent,8160370,Male,9494774,,,,
8188602,"Iphimedousa (Danaid)",Iphimedousa,,,,,Danaid,Agent,8160370,Female,9494773,,,,
8188603,"Iphinoe (daughter of Proitos)",Iphinoe,,,,,"daughter of Proitos",Agent,8160370,Female,9494773,,,,
8188604,"Iphis (daughter of Thespios)",Iphis,,,,,"daughter of Thespios",Agent,8160370,Female,9494773,,,,
8188605,"Iphis (son of Alector)",Iphis,,,,,"son of Alector",Agent,8160370,Male,9494774,,,,
8188606,"Iphitos (son of Eurytos)",Iphitos,,,,,"son of Eurytos",Agent,8160370,Male,9494774,,,,
8188607,"Iphitos (Argonaut)",Iphitos,,,,,Argonaut,Agent,8160370,Male,9494774,,,,
8188608,"Iphitos (killed by Copreus)",Iphitos,,,,,"killed by Copreus",Agent,8160370,Male,9494774,,,,
8188609,"Iris (daughter of Thaumas)",Iris,,,,,"daughter of Thaumas",Agent,8160370,Female,9494773,,,,
8188610,"Ischys (son of Coronos)",Ischys,,,,,"son of Coronos",Agent,8160370,Male,9494774,,,,
8188611,"Isis (Egyptian goddess)",Isis,,,,,"Egyptian goddess",Agent,8160370,Female,9494773,,,,
8188612,"Ismaros (son of Astacos)",Ismaros,,,,,"son of Astacos",Agent,8160370,Male,9494774,,,,
8188613,"Ismaros (son of Eumolpos)",Ismaros,,,,,"son of Eumolpos",Agent,8160370,Male,9494774,,,,
8188614,"Ismene (daughter of Oidipous)",Ismene,,,,,"daughter of Oidipous",Agent,8160370,Female,9494773,,,,
8188615,"Ismene (daughter of Asopos)",Ismene,,,,,"daughter of Asopos",Agent,8160370,Female,9494773,,,,
8188616,"Ismenos (son of Niobe)",Ismenos,,,,,"son of Niobe",Agent,8160370,Male,9494774,,,,
8188617,"Ismenos (son of Asopos)",Ismenos,,,,,"son of Asopos",Agent,8160370,Male,9494774,,,,
8188618,"Istros (son of Aigyptos)",Istros,,,,,"son of Aigyptos",Agent,8160370,Male,9494774,,,,
8188619,"Itanos (suitor of Penelope)",Itanos,,,,,"suitor of Penelope",Agent,8160370,Male,9494774,,,,
8188620,"Ithacos (suitor of Penelope)",Ithacos,,,,,"suitor of Penelope",Agent,8160370,Male,9494774,,,,
8188621,"Itys (son of Tereus)",Itys,,,,,"son of Tereus",Agent,8160370,Male,9494774,,,,
8188622,"Ixion (suffers eternal punishment for trying to rape Hera)",Ixion,,,,,"suffers eternal punishment for trying to rape Hera",Agent,8160370,Male,9494774,,,,
8188623,"Jason (leader of the Argonauts)",Jason,,,,,"leader of the Argonauts",Agent,8160370,Male,9494774,,,,
8188624,"Labdacos (father of Laios)",Labdacos,,,,,"father of Laios",Agent,8160370,Male,9494774,,,,
8188625,"Lachesis (one of the Moirai)",Lachesis,,,,,"one of the Moirai",Agent,8160370,Female,9494773,,,,
8188626,"Laertes (Argonaut, Calydonian Boar hunter, father of Odysseus)",Laertes,,,,,"Argonaut, Calydonian Boar hunter, father of Odysseus",Agent,8160370,Male,9494774,,,,
8188628,"Laios (father of Oidipous)",Laios,,,,,"father of Oidipous",Agent,8160370,Male,9494774,,,,
8188629,"Lamas (suitor of Penelope)",Lamas,,,,,"suitor of Penelope",Agent,8160370,Male,9494774,,,,
8188630,"Lampos (son of Aigyptos)",Lampos,,,,,"son of Aigyptos",Agent,8160370,Male,9494774,,,,
8188631,"Lampos (son of Laomedon)",Lampos,,,,,"son of Laomedon",Agent,8160370,Male,9494774,,,,
8188632,"Laocoon (Trojan seer)",Laocoon,,,,,"Trojan seer",Agent,8160370,Male,9494774,,,,
8188633,"Laodamas (son of Eteocles)",Laodamas,,,,,"son of Eteocles",Agent,8160370,Male,9494774,,,,
8188634,"Laodameia (wife of Protesilaos)",Laodameia,,,,,"wife of Protesilaos",Agent,8160370,Female,9494773,,,,
8188635,"Laodameia (daughter of Bellerophontes)",Laodameia,,,,,"daughter of Bellerophontes",Agent,8160370,Female,9494773,,,,
8188636,"Laodice (daughter of Priam)",Laodice,,,,,"daughter of Priam",Agent,8160370,Female,9494773,,,,
8188637,"Laodice (daughter of Cinyras)",Laodice,,,,,"daughter of Cinyras",Agent,8160370,Female,9494773,,,,
8188638,"Laodicos (suitor of Penelope)",Laodicos,,,,,"suitor of Penelope",Agent,8160370,Male,9494774,,,,
8188639,"Laodocos (son of Phthia and Apollo)",Laodocos,,,,,"son of Phthia and Apollo",Agent,8160370,Male,9494774,,,,
8188640,"Laodocos (son of Priam)",Laodocos,,,,,"son of Priam",Agent,8160370,Male,9494774,,,,
8188641,"Laodocos (wins javelin contest at Nemea)",Laodocos,,,,,"wins javelin contest at Nemea",Agent,8160370,Male,9494774,,,,
8188642,"Laogora (daughter of Cinyras)",Laogora,,,,,"daughter of Cinyras",Agent,8160370,Female,9494773,,,,
8188643,"Laogoras (king of the Dryopes)",Laogoras,,,,,"king of the Dryopes",Agent,8160370,Male,9494774,,,,
8188822,"Theseus (Athenian hero)",Theseus,,,,,"Athenian hero",Agent,8160370,Male,9494774,,,,
8188823,"Sceiron (Opponent of Theseus)",Sceiron,,,,,"Opponent of Theseus",Agent,8160370,Male,9494774,,,,
8188824,"Typhon (son of Ge)",Typhon,,,,,"son of Ge",Agent,8160370,Male,9494774,,,,
8188831,"Pelops (son of Tantalos)",Pelops,,,,,"son of Tantalos",Agent,8160370,Male,9494774,,,,
8189076,"Oreia (daughter of Thespios)",Oreia,,,,,"daughter of Thespios",Agent,8160370,Female,9494773,,,,
8189077,"Oreithyia (daughter of Erechtheus)",Oreithyia,,,,,"daughter of Erechtheus",Agent,8160370,Female,9494773,,,,
8189078,"Orestes (son of Agamemnon and Clytaimnestra)",Orestes,,,,,"son of Agamemnon and Clytaimnestra",Agent,8160370,Male,9494774,,,,
8189079,"Orestes (son of Acheloos)",Orestes,,,,,"son of Acheloos",Agent,8160370,Male,9494774,,,,
8189080,"Orion (a gigantic autochthon)",Orion,,,,,"a gigantic autochthon",Agent,8160370,Male,9494774,,,,
8189081,"Ormenios (suitor of Penelope)",Ormenios,,,,,"suitor of Penelope",Agent,8160370,Male,9494774,,,,
8189082,"Ormenos (suitor of Penelope)",Ormenos,,,,,"suitor of Penelope",Agent,8160370,Male,9494774,,,,
8189083,"Orpheus (husband of Eurydice)",Orpheus,,,,,"husband of Eurydice",Agent,8160370,Male,9494774,,,,
8189084,"Orsedice (daughter of Cinyras)",Orsedice,,,,,"daughter of Cinyras",Agent,8160370,Female,9494773,,,,
8189085,"Orseis (wife of Hellen)",Orseis,,,,,"wife of Hellen",Agent,8160370,Female,9494773,,,,
8189086,"Orthaia (daughter of Hyacinthos)",Orthaia,,,,,"daughter of Hyacinthos",Agent,8160370,Female,9494773,,,,
8189087,"Orthos (Geryones' two-headed guard dog)",Orthos,,,,,"Geryones' two-headed guard dog",Agent,8160370,Male,9494774,,,,
8189088,"Otos (one of the Aloadai)",Otos,,,,,"one of the Aloadai",Agent,8160370,Male,9494774,,,,
8189089,"Otera (Amazon)",Otera,,,,,Amazon,Agent,8160370,Female,9494773,,,,
8189090,"Otreus (father of Placia)",Otreus,,,,,"father of Placia",Agent,8160370,Male,9494774,,,,
8189091,"Oudaios (one of the Spartoi)",Oudaios,,,,,"one of the Spartoi",Agent,8160370,Male,9494774,,,,
8189092,"Ourania Urania (Muse)",Ourania,,,Urania,,Muse,Agent,8160370,Female,9494773,,,,
8189093,"Oxylos (son of Andraimon)",Oxylos,,,,,"son of Andraimon",Agent,8160370,Male,9494774,,,,
8189094,"Oxylos (son of Ares)",Oxylos,,,,,"son of Ares",Agent,8160370,Male,9494774,,,,
8189095,"Oxyporos (son of Pygmalion)",Oxyporos,,,,,"son of Pygmalion",Agent,8160370,Male,9494774,,,,
8189096,"Palaimon (divine name of Melicertes)",Palaimon,,,,,"divine name of Melicertes",Agent,8160370,Male,9494774,,,,
8189097,"Palaimon (Argonaut)",Palaimon,,,,,Argonaut,Agent,8160370,Male,9494774,,,,
8189098,"Palaimon (son of Heracles)",Palaimon,,,,,"son of Heracles",Agent,8160370,Male,9494774,,,,
8189099,"Palamedes (son of Nauplios)",Palamedes,,,,,"son of Nauplios",Agent,8160370,Male,9494774,,,,
8189100,"Pallas (Giant)",Pallas,,,,,Giant,Agent,8160370,Male,9494774,,,,
8189101,"Pallas (son of Creios and Eurybia)",Pallas,,,,,"son of Creios and Eurybia",Agent,8160370,Male,9494774,,,,
8189102,"Pallas (son of Pandion)",Pallas,,,,,"son of Pandion",Agent,8160370,Male,9494774,,,,
8189103,"Pallas (daughter of Triton)",Pallas,,,,,"daughter of Triton",Agent,8160370,Female,9494773,,,,
8189104,"Pallas (son of Lycaon)",Pallas,,,,,"son of Lycaon",Agent,8160370,Male,9494774,,,,
8189105,"Pammon (son of Priam)",Pammon,,,,,"son of Priam",Agent,8160370,Male,9494774,,,,
8189106,"Pamphylos (son of Aigimios)",Pamphylos,,,,,"son of Aigimios",Agent,8160370,Male,9494774,,,,
8189107,"Pan (son of Zeus and Hubris)",Pan,,,,,"son of Zeus and Hubris",Agent,8160370,Male,9494774,,,,
8189108,"Pan (son of Penelope and Hermes)",Pan,,,,,"son of Penelope and Hermes",Agent,8160370,Male,9494774,,,,
8189109,"Pandaros (son of Lycaon)",Pandaros,,,,,"son of Lycaon",Agent,8160370,Male,9494774,,,,
8189110,"Pandion (king of Athens, son of Cecrops)",Pandion,,,,,"king of Athens, son of Cecrops",Agent,8160370,Male,9494774,,,,
8189111,"Pandion (king of Athens, son of Erichthonios)",Pandion,,,,,"king of Athens, son of Erichthonios",Agent,8160370,Male,9494774,,,,
8189112,"Pandion (son of Aigyptos)",Pandion,,,,,"son of Aigyptos",Agent,8160370,Male,9494774,,,,
8189113,"Pandion (son of Phineus)",Pandion,,,,,"son of Phineus",Agent,8160370,Male,9494774,,,,
8189114,"Pandora (first mortal woman)",Pandora,,,,,"first mortal woman",Agent,8160370,Female,9494773,,,,
8189115,"Pandoros (son of Erechtheus)",Pandoros,,,,,"son of Erechtheus",Agent,8160370,Male,9494774,,,,
8189116,"Pandrosos (daughter of Cecrops)",Pandrosos,,,,,"daughter of Cecrops",Agent,8160370,Female,9494773,,,,
8189117,"Panope (Nereid)",Panope,,,,,Nereid,Agent,8160370,Female,9494773,,,,
8189118,"Panope (daughter of Thespios)",Panope,,,,,"daughter of Thespios",Agent,8160370,Female,9494773,,,,
8189119,"Paralos (suitor of Penelope)",Paralos,,,,,"suitor of Penelope",Agent,8160370,Male,9494774,,,,
8189120,"Pareia (nymph, mother of children by Minos)",Pareia,,,,,"nymph, mother of children by Minos",Agent,8160370,Female,9494773,,,,
8189121,"Parthenopaios (one of the Seven against Thebes)",Parthenopaios,,,,,"one of the Seven against Thebes",Agent,8160370,Male,9494774,,,,
8189122,"Parthenope (daughter of Stymphalos)",Parthenope,,,,,"daughter of Stymphalos",Agent,8160370,Female,9494773,,,,
8189123,"Pasiphae (wife of Minos, mother of Minotaur)",Pasiphae,,,,,"wife of Minos, mother of Minotaur",Agent,8160370,Female,9494773,,,,
8189124,"Patro (daughter of Thespios)",Patro,,,,,"daughter of Thespios",Agent,8160370,Female,9494773,,,,
8189125,"Patroclos (son of Menoitios)",Patroclos,,,,,"son of Menoitios",Agent,8160370,Male,9494774,,,,
8189126,"Patroclos (son of Heracles)",Patroclos,,,,,"son of Heracles",Agent,8160370,Male,9494774,,,,
8189127,"Pedias (daughter of Mynes)",Pedias,,,,,"daughter of Mynes",Agent,8160370,Female,9494773,,,,
8189128,"Pegasos (winged horse)",Pegasos,,,,,"winged horse",Agent,8160370,Male,9494774,,,,
8189129,"Peiras (son of Argos)",Peiras,,,,,"son of Argos",Agent,8160370,Male,9494774,,,,
8189130,"Peiren (father of Io)",Peiren,,,,,"father of Io",Agent,8160370,Male,9494774,,,,
8189131,"Peiren (brother of Bellerophontes)",Peiren,,,,,"brother of Bellerophontes",Agent,8160370,Male,9494774,,,,
8189132,"Peirene (Danaid)",Peirene,,,,,Danaid,Agent,8160370,Female,9494773,,,,
8189133,"Peirithous (Calydonian Boar hunter)",Peirithous,,,,,"Calydonian Boar hunter",Agent,8160370,Male,9494774,,,,
8189134,"Peisandros (suitor of Penelope)",Peisandros,,,,,"suitor of Penelope",Agent,8160370,Male,9494774,,,,
8189135,"Peisenor (suitor of Penelope)",Peisenor,,,,,"suitor of Penelope",Agent,8160370,Male,9494774,,,,
8189136,"Peisidice (daughter of Aiolos)",Peisidice,,,,,"daughter of Aiolos",Agent,8160370,Female,9494773,,,,
8189137,"Peisidice (daughter of Nestor)",Peisidice,,,,,"daughter of Nestor",Agent,8160370,Female,9494773,,,,
8189138,"Peisidice (daughter of Pelias)",Peisidice,,,,,"daughter of Pelias",Agent,8160370,Female,9494773,,,,
8189139,"Peisinoe (one of the Sirens)",Peisinoe,,,,,"one of the Sirens",Agent,8160370,Female,9494773,,,,
8189140,"Peisistratos (son of Nestor)",Peisistratos,,,,,"son of Nestor",Agent,8160370,Male,9494774,,,,
8189141,"Peisos (son of Aphareus)",Peisos,,,,,"son of Aphareus",Agent,8160370,Male,9494774,,,,
8189142,"Pelagon (son of Asopos)",Pelagon,,,,,"son of Asopos",Agent,8160370,Male,9494774,,,,
8189143,"Pelasgos Pelasgus (Eponym of the Pelasgians)",Pelasgos,,Pelasgus,,,"Eponym of the Pelasgians",Agent,8160370,Male,9494774,,,,
8189144,"Pelasgos (father of Hippothoos)",Pelasgos,,,,,"father of Hippothoos",Agent,8160370,Male,9494774,,,,
8189145,"Pelegon (son of Axios)",Pelegon,,,,,"son of Axios",Agent,8160370,Male,9494774,,,,
8189146,"Peleus (son of Aiacos)",Peleus,,,,,"son of Aiacos",Agent,8160370,Male,9494774,,,,
8189147,"Pelias (king of Iolcos)",Pelias,,,,,"king of Iolcos",Agent,8160370,Male,9494774,,,,
8189148,"Glauce (Alternative name for Hippolyte)",Glauce,,,,,"Alternative name for Hippolyte",Agent,8160370,Female,9494773,,,,
8189150,"the Gorgons()","the Gorgons",,,,,,"Collective (misc.)",8160371,,,,,,
8189151,"the Harpies()","the Harpies",,,,,,"Collective (misc.)",8160371,,,,,,
8189152,"Hecate (goddess)",Hecate,,,,,goddess,Agent,8160370,Female,9494773,,,,
8189153,"Helen (Helen of Troy)",Helen,,,,,"Helen of Troy",Agent,8160370,Female,9494773,,,,
8189154,"Pellas (suitor of Penelope)",Pellas,,,,,"suitor of Penelope",Agent,8160370,Male,9494774,,,,
8189155,"Pelopeia (daughter of Pelias)",Pelopeia,,,,,"daughter of Pelias",Agent,8160370,Female,9494773,,,,
8189156,"Pelopia (daughter of Niobe)",Pelopia,,,,,"daughter of Niobe",Agent,8160370,Female,9494773,,,,
8189157,"Pelopia (mother of Cycnos)",Pelopia,,,,,"mother of Cycnos",Agent,8160370,Female,9494773,,,,
8189158,"Hierax (reveals Zeus' plan)",Hierax,,,,,"reveals Zeus' plan",Agent,8160370,Male,9494774,,,,
8189159,"Hippodameia (fiancee of Peirithous)",Hippodameia,,,,,"fiancee of Peirithous",Agent,8160370,Female,9494773,,,,
8189160,"Hippolyte (Amazonian wife of Theseus)",Hippolyte,,,,,"Amazonian wife of Theseus",Agent,8160370,Female,9494773,,,,
8189161,"Asterios (alternate name for the Minotaur)",Asterios,,,,,"alternate name for the Minotaur",Agent,8160370,Male,9494774,,,,
8189162,"the Horai (personifications of the Seasons)","the Horai",,,,,"personifications of the Seasons","Collective (misc.)",8160371,,,,,,
8189163,"Hubris (personification of Hubris)",Hubris,,,,,"personification of Hubris",Agent,8160370,Female,9494773,,,,
8189164,"the Hundred-Handers()","the Hundred-Handers",,,,,,"Collective (misc.)",8160371,,,,,,
8189165,"Iambe (jokes with Demeter)",Iambe,,,,,"jokes with Demeter",Agent,8160370,Female,9494773,,,,
8189166,"Icarus (son of Daidalos)",Icarus,,,,,"son of Daidalos",Agent,8160370,Male,9494774,,,,
8189167,"Io (transformed into a cow)",Io,,,,,"transformed into a cow",Agent,8160370,Female,9494773,,,,
8189168,"Iphicles (son of Amphitryon)",Iphicles,,,,,"son of Amphitryon",Agent,8160370,Male,9494774,,,,
8189169,"Lacedaimon (son of Zeus and Taygete)",Lacedaimon,,,,,"son of Zeus and Taygete",Agent,8160370,Male,9494774,,,,
8189170,"the Muses()","the Muses",,,,,,"Collective (misc.)",8160371,,,,,,
8189171,"Peloros (one of the Spartoi)",Peloros,,,,,"one of the Spartoi",Agent,8160370,Male,9494774,,,,
8189172,"Peneleos (Argonaut)",Peneleos,,,,,Argonaut,Agent,8160370,Male,9494774,,,,
8189173,"Penelope (wife of Odysseus)",Penelope,,,,,"wife of Odysseus",Agent,8160370,Female,9494773,,,,
8189174,"Penthesileia (daughter of Ares and Otrera)",Penthesileia,,,,,"daughter of Ares and Otrera",Agent,8160370,Female,9494773,,,,
8189175,"Pentheus (son of Echion)",Pentheus,,,,,"son of Echion",Agent,8160370,Male,9494774,,,,
8189176,"Peparethos (son of Dionysos)",Peparethos,,,,,"son of Dionysos",Agent,8160370,Male,9494774,,,,
8189177,"Pephredo (one of the Phorcides)",Pephredo,,,,,"one of the Phorcides",Agent,8160370,Female,9494773,,,,
8189178,"Perdix (sister of Daidalos)",Perdix,,,,,"sister of Daidalos",Agent,8160370,Female,9494773,,,,
8189179,"Pereus (son of Elatos)",Pereus,,,,,"son of Elatos",Agent,8160370,Male,9494774,,,,
8189180,"Periboia (wife of Telamon, mother of Aias)",Periboia,,,,,"wife of Telamon, mother of Aias",Agent,8160370,Female,9494773,,,,
8189181,"Periboia (wife of Polybos, Oidipous' foster mother)",Periboia,,,,,"wife of Polybos, Oidipous' foster mother",Agent,8160370,Female,9494773,,,,
8189182,"Periboia (daughter of Hipponoos)",Periboia,,,,,"daughter of Hipponoos",Agent,8160370,Female,9494773,,,,
8189183,"Periboia (Locrian virgin sent to Troy)",Periboia,,,,,"Locrian virgin sent to Troy",Agent,8160370,Female,9494773,,,,
8189184,"Periboia (mother of Penelope)",Periboia,,,,,"mother of Penelope",Agent,8160370,Female,9494773,,,,
8189185,"Periclymenos (Argonaut)",Periclymenos,,,,,Argonaut,Agent,8160370,Male,9494774,,,,
8189186,"Periclymenos (son of Poseidon)",Periclymenos,,,,,"son of Poseidon",Agent,8160370,Male,9494774,,,,
8189187,"Periclymenos (suitor of Penelope)",Periclymenos,,,,,"suitor of Penelope",Agent,8160370,Male,9494774,,,,
8189188,"Perieres (charioteer of Menoiceus)",Perieres,,,,,"charioteer of Menoiceus",Agent,8160370,Male,9494774,,,,
8189189,"Perieres (son of Cynortas)",Perieres,,,,,"son of Cynortas",Agent,8160370,Male,9494774,,,,
8189190,"Perileos (son of Icarios)",Perileos,,,,,"son of Icarios",Agent,8160370,Male,9494774,,,,
8189191,"Perimedes (son of Eurystheus)",Perimedes,,,,,"son of Eurystheus",Agent,8160370,Male,9494774,,,,
8189192,"Perimedes (suitor of Penelope)",Perimedes,,,,,"suitor of Penelope",Agent,8160370,Male,9494774,,,,
8189193,"Perimede (daughter of Aiolos)",Perimede,,,,,"daughter of Aiolos",Agent,8160370,Female,9494773,,,,
8189194,"Perimede (sister of Amphitryon)",Perimede,,,,,"sister of Amphitryon",Agent,8160370,Female,9494773,,,,
8189195,"Periopis (daughter of Pheres)",Periopis,,,,,"daughter of Pheres",Agent,8160370,Female,9494773,,,,
8189196,"Periphas (son of Aigyptos)",Periphas,,,,,"son of Aigyptos",Agent,8160370,Male,9494774,,,,
8189197,"Periphas (suitor of Penelope)",Periphas,,,,,"suitor of Penelope",Agent,8160370,Male,9494774,,,,
8189198,"Periphetes (son of Hephaistos)",Periphetes,,,,,"son of Hephaistos",Agent,8160370,Male,9494774,,,,
8189199,"Periphron (suitor of Penelope)",Periphron,,,,,"suitor of Penelope",Agent,8160370,Male,9494774,,,,
8189200,"Peristhenes (son of Aigyptos)",Peristhenes,,,,,"son of Aigyptos",Agent,8160370,Male,9494774,,,,
8189201,"Pero (daughter of Neleus, wife of Bias)",Pero,,,,,"daughter of Neleus, wife of Bias",Agent,8160370,Female,9494773,,,,
8189202,"Perse (daughter of Helios)",Perse,,,,,"daughter of Helios",Agent,8160370,Female,9494773,,,,
8189203,"Perseis (wife of Helios)",Perseis,,,,,"wife of Helios",Agent,8160370,Female,9494773,,,,
8189204,"Persephone Proserpina (daughter of Demeter)",Persephone,,,Proserpina,,"daughter of Demeter",Agent,8160370,Female,9494773,,,,
8189205,"Kore (alternate name for Persephone)",Kore,,,,,"alternate name for Persephone",Agent,8160370,Female,9494773,,,,
8189206,"Perses (brother of Aietes)",Perses,,,,,"brother of Aietes",Agent,8160370,Male,9494774,,,,
8189207,"Perses (son of Creios and Eurybia)",Perses,,,,,"son of Creios and Eurybia",Agent,8160370,Male,9494774,,,,
8189208,"Perses (son of Perseus)",Perses,,,,,"son of Perseus",Agent,8160370,Male,9494774,,,,
8189209,"Perseus (Greek Hero, slayer of Medousa)",Perseus,,,,,"Greek Hero, slayer of Medousa",Agent,8160370,Male,9494774,,,,
8189210,"Perseus (son of Nestor)",Perseus,,,,,"son of Nestor",Agent,8160370,Male,9494774,,,,
8189211,"Peteos (father of Menestheus)",Peteos,,,,,"father of Menestheus",Agent,8160370,Male,9494774,,,,
8189212,"Peucetios (son of Lycaon)",Peucetios,,,,,"son of Lycaon",Agent,8160370,Male,9494774,,,,
8189213,"Phaethon (son of Tithonos)",Phaethon,,,,,"son of Tithonos",Agent,8160370,Male,9494774,,,,
8189214,"Phaidimos (son of Niobe)",Phaidimos,,,,,"son of Niobe",Agent,8160370,Male,9494774,,,,
8189215,"Phaidra (daughter of Minos, wife of Theseus)",Phaidra,,,,,"daughter of Minos, wife of Theseus",Agent,8160370,Female,9494773,,,,
